Responsedate,Name,Account Name,Email,Attendee Type,Campaign Name,Adhoc SFDC Account - ID,Adhoc SFDC Contact - ID,Program Name,Survey ID,How satisfied are you with the relevance and value of the content presented at Frontiers 2026?,Fuel for Brand Fandom Keynote,Q+A Panel with Editors,Workshop,How likely are you to apply the strategies or insights shared during Frontiers with your business?,"Based on your experience with us, how likely are you to collaborate with News
Australia in the future?",What would be the most helpful next step for your business?,What is the reason for providing the score? (Optional),What is one thing we could change or add that would have made this event more impactful for you? (optional)
2026-05-27 22:15:56,Zach Goodman,PHD Networks Pty Ltd,zach.goodman@omc.com,Agency,fy26-nca-frontiers-evt-vic-consortium-omnicom-day2-client,003Ii000002mqGEIAY,0019000000npIzqAAE,Frontiers 2026,914618,4,5,3,5,4,4,,"I loved lees presentation very engaging and relevant and inspiring.

Great atmosphere all round and felt very looked after. The client workshops were great and Elizabeth and Pat drove a brilliant level of enthusiasm and optimism in the room, the clients left feeling very excited. 

One slight feedback is that I wasn’t overly sold on the panel, the speakers were great! Nothing against them or Taylor who was excellent facilitator.  But perhaps for a panel in small room Like that, it could be better to either include a client, an agency member or if there was a guest speaker type person as well as news members. Overall brilliant event and look forward to next year",
2026-05-27 19:36:04,Samantha Hey,Omnicom Media Group Australia Pty Ltd..,sam.hey@omc.com,Agency,fy26-nca-frontiers-evt-vic-consortium-omnicom-day2-client,0039000001fwc00AAA,0019000001s3NOAAA2,Frontiers 2026,914568,4,4,4,5,4,5,,The Passion piece fed really nicely into the workshops and how the teams framed the briefs.,"The workshop was so valuable, Corey and Helen did a wonderful job moderating and taking in all the information. The step change this year to including clients in the day was really beneficial and a great use of the workshops."
2026-05-27 19:09:55,Makayla Paraskevas,PHD Networks Pty Ltd,makayla.paraskevas@omc.com,Agency,fy26-nca-frontiers-evt-vic-consortium-omnicom-day2-client,0032y000004qJEjAAM,0019000000npIzqAAE,Frontiers 2026,914562,5,5,4,5,4,4,,"Great event, it was really productive having clients there to see the value. Workshop was well thought out.",
2026-05-27 14:57:09,Liz Lonsdale,Starcom Australia Vic,liz.lonsdale@starcomww.com,Agency,fy26-nca-frontiers-evt-vic-consortium-publicis-client,003OY00000bfEWMYA2,0019000000npYgOAAU,Frontiers 2026,914479,4,4,3,4,3,4,,,
2026-05-26 21:38:05,Ashley Gilbert,Universal McCann Melbourne,ashley.gilbert@umww.com,Agency,fy26-nca-frontiers-evt-vic-consortium-omnicom-day1-client,0032y00000LAa08AAD,0019000000npg3BAAQ,Frontiers 2026,914350,5,5,4,5,5,5,,"I thought having the clients there was really valuable, and will help keep us all that little bit more accountable. 

Definitely the best content and outputs from the Frontiers I've been lucky to attend.","I don't think I would have changed anything. Also I think all the sessions were the right length, so great work there. 
Well done on a successful Frontiers!"
2026-05-26 19:07:59,Elizabeth Bisset,Priceline Head Office,elizabeth.bisset@priceline.com.au,Client,fy26-nca-frontiers-evt-vic-consortium-omnicom-day1-client,0019000000npWSjAAM,003OY00000dXfNiYAK,Frontiers 2026,914302,5,5,4,5,3,4,,The focus on passion and fandom was incredibly insightful and a fantastic lense to guide the workshop and ideation.,
2026-05-26 18:50:41,Benton Goodbrand,Kinesso,benton.goodbrand@kinesso.com,Agency,fy26-nca-frontiers-evt-vic-consortium-omnicom-day1-client,0012y000005dMzcAAE,0032v00002n5TWVAA2,Frontiers 2026,914298,5,N/A,4,5,4,5,,"Good content, workshop came up with some great ideas, & good company.  The vibe was spot on with the team & client. I really enjoyed myself",Good content length and enough breaks.  It's always a juggle but I felt that this year was well balanced.
2026-05-25 22:21:32,Simon Schoen,Zenith Australia Pty Ltd,simon.schoen@zenithmedia.com,Agency,fy26-nca-frontiers-evt-vic-consortium-publicis-client,0019000000npRYaAAM,0039000000pPEyIAAW,Frontiers 2026,914051,4,5,3,4,4,4,,,
2026-05-25 20:26:40,Michaela Drewe,Spark Foundry,michaela.drewe@sparkfoundryww.com,Agency,fy26-nca-frontiers-evt-vic-consortium-publicis-client,0012v00002LNMERAA5,0032y00000DjVrXAAV,Frontiers 2026,914009,4,5,3,4,4,4,,"Fantastic presentation by The Growth Distillery - easy to follow, very insightful.","Only suggestion during the workshop was to look at insights/data run for competitive brands and the fandoms they are attracting with their customers, not just our own brand - especially in a market where we need to attract competitive buyers."
2026-05-25 19:05:31,Ally Cooney,Spark Foundry,ally.cooney@sparkfoundryww.com,Agency,fy26-nca-frontiers-evt-vic-consortium-publicis-client,0012v00002LNMERAA5,0032y00000DjVMPAA3,Frontiers 2026,913984,5,5,4,4,3,4,,The content is always interesting and removes us from our day-to-day work to get a broader perspective.,
2026-05-25 19:04:46,Jasmin Christie,ZENITH MEDIA,jasmin.christie@publicismedia.com,Agency,fy26-nca-frontiers-evt-vic-consortium-publicis-client,0012y00000L5YcuAAF,003OY00000dYGiEYAW,Frontiers 2026,913983,5,5,4,5,5,5,,Loved the workshop. It was clear lots of effort and thought was put into this - thank you!,
2026-05-25 18:25:51,Alexsandra Smith,Spark Foundry,alexandra.smith@sparkfoundryww.com,Agency,fy26-nca-frontiers-evt-vic-consortium-publicis-client,0012v00002LNMERAA5,0032y00000HxuCRAAZ,Frontiers 2026,913963,5,5,4,5,5,5,,The preparation for the workshop based on the brief provided was good. It made for a very directional workshop session which should have some good outcomes with regards to a content proposal.,Not anything I can think of
2026-05-25 17:44:18,Rhonda Dunlop,Spark Foundry,rhonda.dunlop@sparkfoundryww.com,Agency,fy26-nca-frontiers-evt-vic-consortium-publicis-client,0012v00002LNMERAA5,0032y000007RRa3AAG,Frontiers 2026,913945,4,5,5,5,4,4,,"Presentations and panel were fantastic in the morning.   Workshops were interactive without being too ""workshoppy""",
2026-05-25 17:32:47,Roger Lintzeris,Starcom Australia Vic,roger.lintzeris@starcomww.com,Agency,fy26-nca-frontiers-evt-vic-consortium-publicis-client,0019000000npYgOAAU,0032y00000NnzhMAAR,Frontiers 2026,913941,5,5,5,5,5,5,,"Great talk at the start of the day around passions - loved the engagement from everyone in the room and the panel talk - Edwina is just amazing! 
Workshops were great - solid conversations....just wish we had a bit longer for MORE ideation - felt like we were only warming up. Beautiful dinner with great company. 
Well done to all involved.",Longer in the workshops for ideation - felt like we were only getting started on the actual ideas - but perhaps better to do in morning when people are switched on and focused.
2026-04-08 23:02:39,Julia Medvedeva,Nunn Media Pty Ltd,julia.medvedeva@nunnmedia.com.au,Agency,fy26-nca-frontiers-evt-nsw-indies-client,0039000000pOxGEAA0,0019000000npYfUAAU,Frontiers 2026,899057,5,5,4,N/A,5,5,Receive a copy of the keynote deck and research whitepaper,"the presentation was very insightful and not a ""hard sell"" style as we often see at these events. One small piece of feedback to make it even better would be to have a few more examples form a female/caretaker perspective - passions/hobbies etc. Many thanks",
2026-04-08 22:59:36,Simon Rutherford,Slingshot Media Ventures Pty Ltd,ruthers@slingshot.com.au,Agency,fy26-nca-frontiers-evt-nsw-indies-client,0039000001YjbhLAAR,0019000000npxGbAAI,Frontiers 2026,899054,3,3,2,N/A,4,3,Receive a copy of the keynote deck and research whitepaper,"The content or information wasn't entirely new to me, as I had done a lot of work around fandoms previously.",
2026-04-08 21:57:34,Katy Lozanicic,Pearman Media Pty Ltd,klozancic@pearman.com.au,Agency,fy26-nca-frontiers-evt-nsw-indies-client,003Ii000002mxLVIAY,0019000000npYlwAAE,Frontiers 2026,898947,5,5,3,N/A,5,5,Receive a copy of the keynote deck and research whitepaper,"The content was interesting, engaging and actionable",Would have loved to meet Lou over lunch
2026-04-01 17:52:47,Rob Wall,Love Media Group Pty Ltd (Planner),rob@lovemedia.com.au,Agency,fy26-nca-frontiers-evt-nsw-indies-client,0032y00000HxfhiAAB,0012y00000L5NxNAAV,Frontiers 2026,895173,5,5,3,N/A,5,5,"No further action needed right now, thank you!",Finally a media owner function with content where I learned stuff and it made me think!,
2026-04-01 17:41:53,Michelle Miroforidis,Nunn Media Pty Ltd,michelle.miroforidis@nunnmedia.com.au,Agency,fy26-nca-frontiers-evt-nsw-indies-client,0032y0000044hrGAAQ,0019000000npYfUAAU,Frontiers 2026,895198,4,4,3,N/A,4,4,Receive a copy of the keynote deck and research whitepaper,"It was a good reminder for how brands can continue to focus on connecting with their desired audiences by understanding their passions, particularly amidst all the global chaos",
2026-04-01 17:23:34,Daniel Cutrone,AVENUE C AGENCY,daniel@avenuec.com.au,Agency,fy26-nca-frontiers-evt-nsw-indies-client,0032y00000DiZ5uAAF,0012v00002OJRQYAA5,Frontiers 2026,895149,4,4,2,N/A,4,4,Receive a copy of the keynote deck and research whitepaper,Good presentation. Would be even better for our clients to hear this first hand. But may have been a little too long to land.,"Tighten the keynote, and have stronger take-aways"
2026-04-01 16:53:09,Jacqui Capel,Today The Brave,jacqui@todaythebrave.com,Agency,fy26-nca-frontiers-evt-nsw-indies-client,0032y00000LADvnAAH,0012y00000hQT6lAAG,Frontiers 2026,895171,4,5,4,N/A,4,5,Receive a copy of the keynote deck and research whitepaper,,
2026-04-01 16:43:26,Vanessa Starr,Frontier Media & Marketing Sydney Pty Ltd,vanessa.starr@frontieraustralia.com.au,Agency,fy26-nca-frontiers-evt-nsw-indies-client,0032y00000F4iMRAAZ,0019000000np9IEAAY,Frontiers 2026,895166,5,5,5,N/A,5,5,"No further action needed right now, thank you!",,
2026-04-01 15:57:46,Kathryn Furnari,Thinkerbell Pty Ltd,kathrynfurnari@thinkerbell.com,Agency,fy26-nca-frontiers-evt-nsw-indies-client,0039000001xGiPuAAK,00190000028eyREAAY,Frontiers 2026,895153,5,5,3,N/A,5,4,Receive a copy of the keynote deck and research whitepaper,Great content. Good panel discussion. Lovel meal and networking opportunity. thank you,
2026-04-01 15:54:00,Begona Loredo,HAVAS MELBOURNE PTY LTD,begona.loredo@havasmedia.com,Agency,fy26-nca-frontiers-evt-vic-indies-client,003OY00000dMGHPYA4,0019000000npYgiAAE,Frontiers 2026,895151,4,5,4,N/A,4,4,Schedule a follow-up workshop to apply today's insights,love the passion speech and behavioural studies - great insights,
2026-04-01 15:52:52,Luisa Estigoy,Apparent Media,luisa.estigoy@apparent.com.au,Agency,fy26-nca-frontiers-evt-nsw-indies-client,0032y00000No637AAB,0012y000005FSnOAAW,Frontiers 2026,895137,5,5,4,N/A,4,5,Receive a copy of the keynote deck and research whitepaper,,
2026-04-01 15:34:04,Mike Wilson,Hatched Media Pty Ltd,mike.w@hatchedmedia.com.au,Agency,fy26-nca-frontiers-evt-nsw-indies-client,0032y00000F6mjjAAB,0019000000sr1M1AAI,Frontiers 2026,895147,5,4,3,N/A,4,4,Receive a copy of the keynote deck and research whitepaper,contemporary and relevant,"added more insights from other (non-News) thought-leaders, to ensure gravitas and make it less of a 'sell'"
2026-04-01 15:24:22,Chris Walton,Nunn Media,chris.walton@nunnmedia.com.au,Agency,fy26-nca-frontiers-evt-nsw-indies-client,0032v00002ryQOEAA2,0019000001l3MqcAAE,Frontiers 2026,895144,4,4,3,N/A,3,5,"No further action needed right now, thank you!",Lee gave an interesting and thought-provoking presentation.  He has a very good delivery style,"This is no fault of your own, but at the moment there are a tsunami of media events.  About 12-14 in my diary since the start of March.  Time is therefore at a premium.  If possible, structuring your session in two, say presentations followed by an optional lunch (where you opt in) will help us manage time a bit better (and potentially save you money!)"
2026-04-01 15:20:59,Jenn Reid,Involved Media,jenn.reid@involvedmedia.com.au,Agency,fy26-nca-frontiers-evt-nsw-indies-client,0032y00000Nmv9TAAR,0019000000npYmIAAU,Frontiers 2026,895140,4,5,4,N/A,5,4,Receive a copy of the keynote deck and research whitepaper,Each of the sessions were a great way to rethink how we approach planning for clients. Finding opportunity in passion and reframe how we can add value to unlock advocacy for our brands.,
2026-04-01 15:19:36,Amelia Thackway,Joy Agency,ameliat@joyagency.co,Agency,fy26-nca-frontiers-evt-nsw-indies-client,0032v00002lAqfFAAS,00190000021V1jHAAS,Frontiers 2026,895142,4,4,2,N/A,4,5,Receive a copy of the keynote deck and research whitepaper,"Frontiers is always a great session.
The Growth Distillery has fantastic insights - I think the session could have been a little tighter, it felt like we saw all the thinking vs the outputs and had to rush the end where more interesting insights were. Still great, but just tighten up. 
The panel was a good length - would enjoy a few punchier topics and discussion for next time! 
Lovely lunch!",
2026-04-01 15:17:42,Noelia Jacobo,Nunn Media Pty Ltd,noelia.jacobo@nunnmedia.com.au,Agency,fy26-nca-frontiers-evt-nsw-indies-client,0032y00000IDbuCAAT,0019000000npYfUAAU,Frontiers 2026,895141,4,4,3,N/A,4,5,Receive a copy of the keynote deck and research whitepaper,,
2026-04-01 15:15:49,Mark O'Brien,Saint Mob Media,mark@saintmob.media,Agency,fy26-nca-frontiers-evt-nsw-indies-client,0032y0000059d9yAAA,0012y000006Lnp7AAC,Frontiers 2026,895138,4,3,3,N/A,4,5,"No further action needed right now, thank you!",Interesting look at strategy to tie in Passion to enhance engagement,More focus on the best products in the News Australia kitbag for client implementation.
2026-04-01 15:13:17,Lisa Blackshaw,Co.Gency Group Pty Limited,lisa@cogencygroup.com.au,Agency,fy26-nca-frontiers-evt-nsw-indies-client,003Ii000002n96KIAQ,0019000001r0gtnAAA,Frontiers 2026,895132,5,5,3,N/A,5,5,Receive a copy of the keynote deck and research whitepaper,The presentation from he Growth Distillery's was fantastic - are we able to get a copy??,
2026-04-01 15:10:08,Shannon Muscolino,ARDENT COMMUNICATIONS PTY LTD,shannon@ardentcom.com.au,Agency,fy26-nca-frontiers-evt-nsw-indies-client,0032y000007wy95AAA,0012y00000RL5LMAA1,Frontiers 2026,895135,4,4,4,N/A,4,4,Receive a copy of the keynote deck and research whitepaper,,
2026-03-30 19:54:27,Peter Toone,Principle Media Group,ptoone@principlemediagroup.com.au,Agency,fy26-nca-frontiers-evt-vic-indies-client,0039000000ozUduAAE,0012v00002OJbc1AAD,Frontiers 2026,894342,4,3,4,N/A,3,5,Receive a copy of the keynote deck and research whitepaper,"Well paced, not too long, useful perspectives","I think the keynote was a bit long, it could have been done in 45 minutes."
2026-03-29 22:06:38,Ben Kershaw,Nunn Media Pty Ltd,ben@nunnmedia.com.au,Agency,fy26-nca-frontiers-evt-vic-indies-client,0019000000npYfUAAU,0032v00002ZSaagAAD,Frontiers 2026,894092,3,3,3,N/A,3,2,Receive a copy of the keynote deck and research whitepaper,"Content was well put-together and there were a few useful things in there. While it's sometimes good to be reminded of untapped opportunities, passions are something the industry was talking about a lot 10+ years ago, so it didn't feel groundbreaking, and many of the experienced marketers in the room would have been down that road.",
2026-03-29 17:55:19,Andrew Gough,HAVAS MELBOURNE PTY LTD,andrew.gough@havasmedia.com,Agency,fy26-nca-frontiers-evt-vic-indies-client,0019000000npYgiAAE,0032y000003pvXeAAI,Frontiers 2026,894009,4,4,2,N/A,3,3,"No further action needed right now, thank you!",,"the keynote was too long - could have been cut to 30/45 mins and had another preso in
didn't see much value in the panel - again could be replaced with something else"
2026-03-26 22:25:54,Thea Reid,Nunn Media Pty Ltd,thea.reid@nunnmedia.com.au,Agency,fy26-nca-frontiers-evt-vic-indies-client,0019000000npYfUAAU,0039000001ih12RAAQ,Frontiers 2026,893375,4,4,4,3,4,4,,many clients are talking about content and ways to better integrate content into their brand strategies.,smaller forums / workshops
2026-03-26 18:47:34,Amy Hallinan,Nunn Media Pty Ltd,amy.hallinan@nunnmedia.com.au,Agency,fy26-nca-frontiers-evt-vic-indies-client,0019000000npYfUAAU,0032y00000MmXzHAAV,Frontiers 2026,893324,3,4,2,N/A,3,3,Receive a copy of the keynote deck and research whitepaper,,
2026-03-26 18:42:29,Jacqui Keleher,Jacqui Keleher Consultancy,jacquikeleher@gmail.com,Agency,fy26-nca-frontiers-evt-vic-indies-client,001OY00000dYAcqYAG,003OY00000dLzQIYA0,Frontiers 2026,893319,5,4,4,N/A,5,5,"No further action needed right now, thank you!","Engaging sessions, first sessions was beautifully executed and presented. topics on point, thoroughly enjoyed!!!",Could have done one more session! :) thanks for having  me!
2026-03-18 14:36:39,Emma Goodyear,Sony Pictures,emma_goodyear@spe.sony.com,Client,fy26-nca-frontiers-evt-nsw-consortium-omnicom-day1-client,0019000000omBqBAAU,0032v00002qiAhwAAE,Frontiers 2026,891096,5,5,5,4,4,4,,"Full marks! The content was extremely relevant to marketing in todays landscape. I am at Sony Pictures (Emma) -  so we are in an interesting position where often we are the passion people have, though we also know that aligning with Australians passions is what makes us become a true cultural event. Everything Lee said resonated with how we are thinking about marketing today, and the things we are trying to achieve as a business. It was great to see News has similar thinking and objectives, and understand how they are thinking about this across their ecosystem. Hearing from Edwina and Ben was fantastic - I found it interesting how much they new about the algorithm and its role in obtaining eyeballs on their content - of course we know this to be true, but they both had such a deep understanding and grasp on it, which was interesting to note from the perspective of two legendary editors and how they are thinking about content. Our Brainstorm was great - Tom was an excellent facilitator, it is one of the better ones i have been involved in, I left feeling like everyone understood our business and the ideas generated had the right level of cultural impact, I am looking forward to seeing how News brings these to life. I left feeling like News Australia were a well-oiled machine in terms of their teams working together - from sales, to strategy to editorial, everyone had a cohesive understanding of what they were needing to achieve as a business and clearly work closely together to make it happen. I also left feeling clear about how we can work with News to achieve our business objectives with more scope than I have thought in the past. A very valued session and I'm in awe at how the day felt equally productive and relaxing, not at all draining. Thank you team for an inspiring time.",would love a copy of Lee's presentation as a follow up. Otherwise - no notes!
2026-03-26 17:48:51,Ashima Swami,Media33 Pty Ltd,ashima@media33.com.au,Agency,fy26-nca-frontiers-evt-vic-indies-client,0019000000w9SQPAA2,003OY00000dMCNTYA4,Frontiers 2026,893302,5,5,5,5,5,5,,,A bit more tasks to get the crowd involved...a quiz or something in the end
2026-03-26 16:56:25,Christine Chen,PHD Networks Pty Ltd,christine.chen@omc.com,Agency,fy26-nca-frontiers-evt-nsw-consortium-omnicom-day2-client,0019000000npIzqAAE,003Ii000002nAftIAE,Frontiers 2026,893277,4,4,3,4,4,4,,Great thought leadership and definitely made it much more relevant to client problems this time around!,
2026-03-25 21:51:38,Daniela Rocchi,Initiative Media Australia Pty Ltd,daniela.rocchi@initiative.com,Agency,fy26-nca-frontiers-evt-nsw-consortium-omnicom-day2-client,0019000000npPgiAAE,0039000000pPlIMAA0,Frontiers 2026,893018,4,5,2,5,4,5,,I felt the content was very relevant to know and relates to Initiative as being a cultural agency. The only content that i though was lacking was the panel discussion really did not take much away from that could have been alot more interesting and relevant.,The panel discussion - A more debate style would have been interesting especially being a news led media channel and what is going on in the world.
2026-03-25 21:31:34,Julian Monty,Initiative Media Australia Pty Ltd,julian.monty@initiative.com,Agency,fy26-nca-frontiers-evt-nsw-consortium-omnicom-day1-client,0019000000npPgiAAE,0032y00000F7QZNAA3,Frontiers 2026,893016,5,5,3,5,4,4,,"Really strong and relevant content, I think all my brands can benefit from all the research surrounding passions and fandom etc.",
2026-03-25 21:26:24,Amanda Watts,Omnicom Media Group Australia Pty Ltd..,amanda.watts@omc.com,Agency,fy26-nca-frontiers-evt-nsw-consortium-omnicom-day1-client,0019000001s3NOAAA2,0032v00002cX9HfAAK,Frontiers 2026,893013,5,4,4,4,4,4,,,
2026-03-25 21:19:23,Ollie Woodrow,CTR_2025_Special Broadcast Service PTY LTD,oliver.woodrow@omc.com,Agency,fy26-nca-frontiers-evt-nsw-consortium-omnicom-day2-client,001Ii000002Z6xsIAC,003Ii000002mo8hIAA,Frontiers 2026,893011,5,5,4,5,5,5,,"You can genuinely tell how much detail, planning and care went into every element of Frontiers. From the structure of the sessions to how seamlessly everything ran on the day, it was an incredibly polished experience. It really reflects the level of service and partnership mindset your team brings, which does not go unnoticed on our side. Safe to say you have set the benchmark and made the rest of the publisher offsite circuit look a little nervous.","It was a flawless event throughout, very difficult to fault. Excellent location."
2026-03-25 20:57:30,Jane Combes,Omnicom Media Group Australia Pty Ltd..,jane.combes@omc.com,Agency,fy26-nca-frontiers-evt-nsw-consortium-omnicom-day1-client,0019000001s3NOAAA2,0032v00002cX9MzAAK,Frontiers 2026,893000,4,5,3,5,4,5,,"It was relevant, topical, interesting and insightful.","I think the changes made to frontiers this year were exceptional - very welcomed and we got a lot out of it. After this successful year, I wouldn't change anything - I'd just say more of the same next year"
2026-03-17 22:32:06,Ali Lawton,Sony Pictures,alison_lawton@spe.sony.com,Client,fy26-nca-frontiers-evt-nsw-consortium-omnicom-day1-client,0019000000omBqBAAU,0032y00000HxZT1AAN,Frontiers 2026,891082,5,5,5,5,5,4,,"very clear, relevant and compelling.","it was wonderful!! very well run, great timing and format."
2026-03-25 20:45:35,Ali Coysh,Initiative Media Australia Pty Ltd,ali.coysh@initiative.com,Agency,fy26-nca-frontiers-evt-nsw-consortium-omnicom-day2-client,0019000000npPgiAAE,0032y00000IBFVCAA5,Frontiers 2026,892995,5,4,3,5,4,3,,"We had clients this year, excellent session, Shep and Belle were highlights that got us and the client excited. Keep the format and more of shep. would love it for more clients",
2026-03-25 20:46:23,Emily Kennon,VOLVO CAR AUSTRALIA PTY LTD,emily.kennon@volvocars.com,Client,fy26-nca-frontiers-evt-nsw-consortium-omnicom-day2-client,0019000000npIpEAAU,003OY00000cPPQLYA4,Frontiers 2026,892993,5,5,3,5,4,4,,"The content was very well presented, it was delivered in an easily digestable way, and easy to apply personally but also in a business context for any brand.","The Q&A session was not as valuable to me, it was good to listen to a discussion about macroeconomic environment, but nothing we didn't already know. Nothing against the presenters, or the delivery they were all fabulous, I just found the other two sessions more valuable with insights or key takeaways. 

Everything else was great! The venue, the format, the workshop, we had enough breaks, great food, great entertainment, loved the pilates in the morning as a little treat, thank you again for hosting us."
2026-03-24 2:55:24,Lisa Squillace,M Media Group Pty Ltd,lisa.squillace@wppmedia.com,Agency,fy26-nca-frontiers-evt-nsw-consortium-wpp-client,0019000000npPiWAAU,003OY00000cwN7NYAU,Frontiers 2026,892541,4,4,3,4,4,5,,I really enjoying the the insight into content and brands that have done great co labs.  The client work was great and we could see the effort and back work that was put into this,
2026-03-18 19:17:24,Andrew Knox,VOLVO CAR AUSTRALIA PTY LTD,andrew.knox@volvocars.com,Client,fy26-nca-frontiers-evt-nsw-consortium-omnicom-day2-client,0019000000npIpEAAU,003OY00000cPDx4YAG,Frontiers 2026,891296,4,5,3,5,4,4,,"I found the presentation from Leigh both informative and relevant. The highlight was the workshop session with Tom in the afternoon. It was also evident that he and his team had done a lot of prework, which ensured we could get right into the main themes of the session and cut to the chase!","It was a very enjoyable event and well run, and the venue was lovely.
The farm animals were a nice surprise. 
The News team made us feel welcome at all times and were excellent hosts.

At the risk of sounding ungrateful, which I am not, it would have been nice to have some fruit, pastries and muffins available upon arrival after driving from Sydney, as most people would not have had breakfast given the early start. I've never been served arancini for morning tea before!"
2026-03-16 23:40:30,Anna Jackson,Westpac Banking Corporation Head Office,anna.jackson@westpac.com.au,Client,fy26-nca-frontiers-evt-nsw-consortium-publicis-client,0019000000npJBtAAM,003Ii000002nXImIAM,Frontiers 2026,890851,5,5,4,5,5,5,,Engaging and informative and all in a beautiful setting with great company,
