2026-03-24 15:42:55,Binaisha Haria,Nestle Australia Limited,binaisha.haria@au.nestle.com,Client,fy26-nca-frontiers-evt-nsw-consortium-wpp-client,0019000000npFNqAAM,003OY00000b3GsXYAU,Frontiers 2026,892638,5,4,3,5,4,4,,"This was a really well-structured session, with great energy! It was great to have the background into passions and how they come to life with brands and then to divide deep into our brands to understand what areas we can play in.","As a first timer, I have no builds. The next steps will give us more to understand how we can apply what we discussed"
2026-03-23 19:19:23,Riya Thakerar,Amazon Australia,riythak@amazon.com,Client,fy26-nca-frontiers-evt-nsw-consortium-wpp-client,00190000012RWm0AAG,0032v00003N9CXFAA3,Frontiers 2026,892437,4,3,3,5,4,5,,I thought the individual team workshops were great and you could tell how much prep work had been done to understand our brief better!,
2026-03-22 15:33:59,Lauren Bray,M Media Group Pty Ltd,lauren.bray@wppmedia.com,Agency,fy26-nca-frontiers-evt-nsw-consortium-wpp-client,0019000000npPiWAAU,0032y00000DllFjAAJ,Frontiers 2026,892101,5,4,4,5,4,5,,"The sessions were informative, moved at a good pace and enabled us to get to fabulous outputs in not much time at all. There was also a good balance of working and networking.",
2026-03-23 18:52:17,Jonathan Theos,Nestle Australia Limited,jonathan.theos@au.nestle.com,Client,fy26-nca-frontiers-evt-nsw-consortium-wpp-client,0019000000npFNqAAM,003OY00000dHQVxYAO,Frontiers 2026,892430,4,5,3,5,4,3,,,
2026-03-22 15:03:52,Blake Power,Omnicom Media Group Australia Pty Ltd..,blake.power@omc.com,Agency,fy26-nca-frontiers-evt-nsw-consortium-omnicom-day2-client,0019000001s3NOAAA2,0032v00002ZS6g2AAD,Frontiers 2026,892089,5,5,5,5,4,5,,"Really appreciated the effort the news team went in developing the workshop, involving our clients and turning the findings into actionable streams for planning. The research on passions lined up very well with existing research from Hearts & Science",I think it was actually a good balance of work and networking.
2026-03-20 3:08:03,Veronik Myburgh,Wavemaker Australia Pty Ltd (NSW),veronik.myburgh@wppmedia.com,Agency,fy26-nca-frontiers-evt-nsw-consortium-wpp-client,0019000000npPiaAAE,00390000014W00HAAS,Frontiers 2026,891619,5,4,3,5,4,5,,"The content is very relevant and timely, and love that it was tailored to our brands when we went into the workshops.","The editorial panel was great, but I felt the panel at the last frontiers gave us more of an insight into what happens under the hood of editorial, which is extremely interesting and allows rare access to your editorial talent."
2026-03-23 18:46:21,Rhys Gower,Audible Ltd,gowerhys@audible.com,Client,fy26-nca-frontiers-evt-nsw-consortium-wpp-client,00190000016sbOBAAY,0032v00003HmLm4AAF,Frontiers 2026,892427,4,4,3,4,4,5,,"Structure of the day was well thought out, with the opening sessions linking directly to the workshops","I think having a bit more context/detail on the content of the morning sessions and how that would inter-relate to the workshops would have been useful when it came to the brief we provided. This may have influenced how we briefed News, or at least some of the framing in the brief."
2026-03-19 20:24:06,Ian Edwards,Wavemaker Australia Pty Ltd (NSW),ian.edwards@wppmedia.com,Agency,fy26-nca-frontiers-evt-nsw-consortium-wpp-client,0019000000npPiaAAE,0039000000pPissAAC,Frontiers 2026,891544,4,4,2,5,3,4,,"Another great session and another build on last year. 
Having a live brief and the clients there was fantastic and great for everyone to be part of the process. 
Looking forward to seeing what comes next",
2026-03-22 20:19:36,Clare Tsubono,Lion Nathan,clare.tsubono@lionco.com,Client,fy26-nca-frontiers-evt-nsw-consortium-wpp-client,0019000000npaKUAAY,0039000000rB0HzAAK,Frontiers 2026,892197,5,5,5,5,5,5,,"Great, intelligent, useful research, that gave us an inspiration for our workshop.  The workshop was well run and incredibly valuable  - to hear ideas, perceptions and passions outside of our marketing dept was amazing.  Venue was lovely and dinner very fun!",
2026-03-19 18:03:12,Callum O'Brien,EssenceMediacom Australia - SYDNEY,callum.obrien1@wppmedia.com,Agency,fy26-nca-frontiers-evt-nsw-consortium-wpp-client,0019000000npYmAAAU,0039000001ihDSKAA2,Frontiers 2026,891505,5,5,4,5,4,4,,The organisation of the day was excellent. The content was on point and the workshop clearly represented an opportunity for the brand and News to find ways in which to partner more deeply,Perhaps more previous examples of the outputs of these workshops so clients can better understand how the finished results might look.
2026-03-19 22:36:13,Emma Wilson,Nestle Australia Limited,emma.wilson@au.nestle.com,Client,fy26-nca-frontiers-evt-nsw-consortium-wpp-client,0019000000npFNqAAM,003OY00000b2zmwYAA,Frontiers 2026,891573,5,5,5,5,5,4,,"the content was very relevant, the conversation with editors helped see whats relevant to your audiences. The workshop was excellent. 
would've been good to see a few more case studies of the theory in action - especially at News corp... seeing best in class examples.","more best in class case studies on application of the theory and seeing it in action.

Having more of the creative agencies in the room wouldve helped too."
2026-03-19 17:34:44,Simon Conyard,Wavemaker Australia Pty Ltd (NSW),simon.conyard@wppmedia.com,Agency,fy26-nca-frontiers-evt-nsw-consortium-wpp-client,0019000000npPiaAAE,00390000026el0RAAQ,Frontiers 2026,891496,4,4,3,5,4,3,,,
2026-03-19 17:31:38,Mimi Clifford,EssenceMediacom Australia - SYDNEY,mimi.clifford@wppmedia.com,Agency,fy26-nca-frontiers-evt-nsw-consortium-wpp-client,0019000000npYmAAAU,003Ii000002muHRIAY,Frontiers 2026,891493,5,5,5,5,5,4,,,
2026-03-18 21:30:40,Gerry Bowness,Mediahub Australia P/L,gerry.bowness@mediahubww.com,Agency,fy26-nca-frontiers-evt-nsw-consortium-omnicom-day1-client,0019000000npiozAAA,0032y00000MjXu1AAF,Frontiers 2026,891325,4,4,3,4,4,4,,,
2026-03-19 19:17:05,Pia McMorran,Audible Ltd,piamcm@audible.com,Client,fy26-nca-frontiers-evt-nsw-consortium-wpp-client,00190000016sbOBAAY,003OY00000cmKmYYAU,Frontiers 2026,891529,4,5,2,5,4,4,,,
2026-03-18 18:01:58,Peita Pacey,Omnicom Media Group Australia Pty Ltd..,peita.pacey@omc.com,Agency,fy26-nca-frontiers-evt-nsw-consortium-omnicom-day2-client,0019000001s3NOAAA2,0039000000pOndmAAC,Frontiers 2026,891283,4,5,4,4,5,5,,"The thought leadership was fantastic, and very timely for our clients. 
Our workshop was a great session, the clients really enjoyed it and commented on it later, we just didn't come out with clear ideas to try because the conversation was a little delayed.  Regarding the passions identified, they did seem a little expected - it would have been great to have more unique and unexpected insights to work with. 
Having said all that, it was a great day and a worthy use of time - we loved it!",
2026-03-18 18:00:36,Hannah Rook,Omnicom Media Group Australia Pty Ltd..,hannah.rook@magnaglobal.com,Agency,fy26-nca-frontiers-evt-nsw-consortium-omnicom-day2-client,0019000001s3NOAAA2,003OY00000d8VMjYAM,Frontiers 2026,891284,4,N/A,2,N/A,4,4,"No further action needed right now, thank you!",,
2026-03-18 15:24:31,Beth McKeown,Omnicom Media Group Australia Pty Ltd..,beth.mckeown@omc.com,Agency,fy26-nca-frontiers-evt-nsw-consortium-omnicom-day1-client,0019000001s3NOAAA2,0032y00000CmTTsAAN,Frontiers 2026,891134,4,4,3,4,3,4,,,
2026-03-19 18:02:30,Tom Donald,Lion Nathan,thomas.donald@lionco.com,Client,fy26-nca-frontiers-evt-nsw-consortium-wpp-client,0019000000npaKUAAY,003OY00000b1HkkYAE,Frontiers 2026,891511,5,5,5,5,4,5,,Great people. Professionally run. Insightful. Helpful. Would recommend to a friend.,Possibly 30 more mins for the workshop. But minor comment.
2026-03-18 2:50:09,Emma Mallinson,American Express Australia Ltd,emma.mallinson@aexp.com,Agency,fy26-nca-frontiers-evt-nsw-consortium-omnicom-day1-client,0019000000np4ZFAAY,0032v00002qghyuAAA,Frontiers 2026,891146,5,5,5,5,5,5,,Incredible conference - best one that I have been to so far!,n/a
2026-03-17 23:19:59,Naysla Edwards,American Express Australia Ltd,naysla.n.edwards@aexp.com,Agency,fy26-nca-frontiers-evt-nsw-consortium-omnicom-day1-client,0019000000np4ZFAAY,0032v00002qfWBNAA2,Frontiers 2026,891105,5,5,5,5,5,5,,"Incredibly innovative concept to align media agency and brands, addressed from a position of problem understanding but also with a proactive approach of sharing research and backing to guide brands forward - pretty impressive. the entire News team gave a 100% of their energy to make all sessions absolutely incredible and I really look forward to working together on wellness opportunity. Thank you Newscorp team you have raised the bar! Thanks Lou, Ed, Ben and Leigh as well as the entire team for been so caring about our brand.",The only opportunity is potentially to share the research so we can familiarise and be more prepare for session but this is more for us to do some pre work and help facilitate workshop with deepr understanding of data matched with our own.
2026-03-12 16:07:05,Jessica Ward,QGOV Tourism and Events Queensland,jessica.ward@queensland.com,Client,fy26-nca-frontiers-evt-qld-consortium-dentsu-client,0019000000npDrZAAU,0032v00002mEsKGAA0,Frontiers 2026,889702,5,4,,5,4,5,,Well structured sessions with relevant insights presented to frame up the workshop and provide informed direction.,With more time to do the pre-work (one-pager) and a little extra insight into how that one-pager would be used we could make sure it was much more fit for purpose
2026-03-02 18:35:52,David Somerville,THE LOTTERY CORPORATION,david.somerville@thelotterycorporation.com,Client,fy26-nca-frontiers-evt-qld-consortium-dentsu-client,0012y00000POHomAAH,003Ii000002mqB1IAI,Frontiers 2026,886162,5,5,,5,5,5,,"A great upfront presentation to set the scene, followed by a dynamic and collaborative working session. I felt we walked away with a genuinely useful idea.",
2026-03-16 21:40:43,Tina Gavros,Publicis Media,tina.gavros@publicisgroupe.net,Agency,fy26-nca-frontiers-evt-nsw-consortium-publicis-client,0019000000omC8bAAE,0039000000rA3x4AAC,Frontiers 2026,890816,5,5,5,N/A,5,5,Have a quick 10-minute discovery call to discuss specific goals,"Multiple reasons really:  People from News are of hgh standard, content was great, having clients at the event is extremely important for conversion of ideas.",send a brief template prior with a theme already set by you.  more clients present and greater emphasis on solving business challenge for client and then conversion of work into real work .
2026-03-16 20:29:30,Drew Usher,Starcom Mediavest Group NSW,drew.usher@starcomww.com,Agency,fy26-nca-frontiers-evt-nsw-consortium-publicis-client,0019000000npYgVAAU,0039000001kwWAAAA2,Frontiers 2026,890791,3,5,3,3,4,4,,"Loved the morning presentation and the set up for why passions matter, understanding the audience journey (from casual to obsession) and how fans engage with passions. It was a great session.

The afternoon workshop was a great idea and structure/process, but the key passions identified for clients were fairly generic and category expected e.g. ""food and drink"" while others were rather obscure e.g. ""puzzles and board games"" which felt more like an ""interest"" rather than a passion (that someone might strive to master or obsess over).

As a result, the workshop limited how we might activate relevant passions in a new/interesting/innovative way and did not quite do justice to the untapped ""power of passions"" and potential of News.",
2026-03-16 19:13:29,Vanessa Winley,Spark Foundry,vanessa.winley@sparkfoundryww.com,Agency,fy26-nca-frontiers-evt-nsw-consortium-publicis-client,0012v00002LNMERAA5,0032y00000ICPbxAAH,Frontiers 2026,890775,5,5,5,5,5,5,,"Great presentation on the Power of Passion, highlighting how content plays a pivotal role in connecting audiences, publishers, and brands. It was a privilege to hear from Ben and Edwina as part of the panel.

The workshop was excellent. Tom was outstanding—navigating many strong voices and differing opinions, capturing all perspectives, and shaping them into an actionable framework for the campaign.
 ","The format, people and content were excellent - I wouldn't change a thing!"
2026-03-16 17:52:31,Lucile Dattin,Zenith Australia Pty Ltd,lucile.dattin@zenithmedia.com,Agency,fy26-nca-frontiers-evt-nsw-consortium-publicis-client,0019000000npRYaAAM,0032v00002ZSmwAAAT,Frontiers 2026,890760,4,4,3,4,4,3,,"Interesting and relevant, thank you!",
2026-03-16 17:42:28,Sophie Mateer,Zenith Australia Pty Ltd,sophie.mateer@zenithmedia.com,Agency,fy26-nca-frontiers-evt-nsw-consortium-publicis-client,0019000000npRYaAAM,003OY00000dADLiYAO,Frontiers 2026,890758,4,5,4,4,4,4,,Loved the research of fandoms and how we can tap into the different 'fuel/motivators' and also understanding at what level on fans are at in their journey (obsessed vs casual). I appreciated the different passions that were drawn out for our specific client but would love to understand further if there are certain ways to tap into different fans based on their fuel e.g. are swimmers despite their level of fandom all motivated by community OR is an obsessed swimmer more fuelled by mastery and a casual swimmer is fuelled by community - more out of curiosity than anything but the overall presentations and workshops were fantastic :),"A more direct link between the fandom research and the q&a session e.g. vogue fandoms vs DT fandoms, would have been interesting but both were great on their own."
2026-03-15 18:23:42,Axelle Torche,Omnicom Media Group Australia Pty Ltd..,axelle.torche@omc.com,Agency,fy26-nca-frontiers-evt-qld-consortium-omnicom-client,0019000001s3NOAAA2,0039000002EJiXsAAL,Frontiers 2026,890505,5,5,,5,5,4,,The format this year was great. The presentation was insightful and the workshop with client being involved led to interesting ideations. Having a little more time for the workshop could have been good!,Slightly longer workshop + short update on News projects for the year ahead or innovation - especially for clients
2026-03-02 17:55:02,Emma Raymond,Gold Coast Tourism Corporation Ltd,emma.raymond@experiencegoldcoast.com,Client,fy26-nca-frontiers-evt-qld-consortium-dentsu-client,0019000000nppV0AAI,0032y00000MlKoQAAV,Frontiers 2026,886144,5,5,,5,4,4,,"Thought-provoking content that tackled real business challenges head-on. The team's passion and deep understanding of the subject came through clearly. A genuinely great group of people to spend the day with, and the dinner was a brilliant way to round it off. Looking forward to taking these ideas back and exploring them further with our team.",
2026-03-05 23:35:54,Danica Luhrs,EssenceMediacom Australia - BRISBANE,danica.luhrs@wppmedia.com,Agency,fy26-nca-frontiers-evt-qld-consortium-wpp-client,0019000000nozTDAAY,003Ii000002mpmDIAQ,Frontiers 2026,887622,5,5,,5,5,5,,"This was an excellent event from the News team - thank you!! Our client from ART and ourselves had the perfect amount of time to workshop the start of a fantastic idea - it's not often we get the time to dig deep into it. The workshop was well linked to the content at the start of the day from the legendary Growth Distillery team. Great team, good energy, great vibes. Thanks again.",
2026-03-05 17:49:12,Milos Mrkaja,Omnicom Media Group Australia Pty Ltd..,milos.mrkaja@omc.com,Agency,fy26-nca-frontiers-evt-qld-consortium-omnicom-client,0019000001s3NOAAA2,0032v00002n5TKrAAM,Frontiers 2026,887533,4,5,,4,4,5,,"The format this year was excellent - a great balance of insightful presentation, workshop time and meaningful interaction with the News team. Including clients was a strong addition and clearly added value, giving them the chance to actively participate, which was very well received.

The only minor suggestion would be to consider tailoring some of the workshop research more closely to the specific products and categories our clients work in, rather than keeping it at a broader retail‑sector level. Adding that layer of relevance could help deepen engagement and make the insights feel even more actionable.",
2026-03-22 15:23:39,Annie Deeth,Michael Hill Jewellers,annie.deeth@michaelhill.com.au,Client,fy26-nca-frontiers-evt-qld-consortium-omnicom-client,001900000268AXaAAM,003OY00000aw9fhYAA,Frontiers 2026,892097,5,5,N/A,5,5,5,,Absolutely loved everything! It felt like the perfect combination of keynote + putting it into practice. Really liked how we were able to immediately take what we learnt and apply it to our business in a group setting - got the creative juices flowing! It's always so nice to get out of your normal space and routine to do some thinking,
2026-03-04 21:01:49,Emma Davis,ZENITH MEDIA Brisbane,emma.davis@zenithmedia.com,Agency,fy26-nca-frontiers-evt-qld-consortium-zenith-client,0012y00000L5YjWAAV,0032y00000KYZS9AAP,Frontiers 2026,887248,5,5,,4,4,5,,"Relevant, thought provoking and well constructed thought leadership followed by workshops to take these insights into actions for brands. Loved it.",A slightly longer time in the workshop as there was such great discussion
2026-03-04 19:49:20,Vikki Pearce,ZENITH MEDIA Brisbane,vikki.pearce@zenithmedia.com,Agency,fy26-nca-frontiers-evt-qld-consortium-zenith-client,0012y00000L5YjWAAV,003Ii000002n0KEIAY,Frontiers 2026,887218,5,5,,4,4,4,,"The content was sharp, relatable and engaging. Really enjoyed it. thank you",
2026-03-04 19:34:36,Hannah MacAuslane,EssenceMediacom Australia - BRISBANE,hannah.macauslane@wppmedia.com,Agency,fy26-nca-frontiers-evt-qld-consortium-wpp-client,0019000000nozTDAAY,003Ii000002mpttIAA,Frontiers 2026,887159,5,4,,5,4,4,,Loved the additional information/ data tailored to client's category in the workshop.,"category focus was good, any brand insights I think could have elevated it."
2026-03-04 17:55:04,TRACEY Fawcett,Wavemaker Australia Pty Ltd (NSW),tracey.fawcett@wppmedia.com,Agency,fy26-nca-frontiers-evt-qld-consortium-wpp-client,0019000000npPiaAAE,0032v00002x4osGAAQ,Frontiers 2026,887177,5,5,,5,5,5,,I found the content really provoking and fresh. Tapping into audiences 'passions' is a rich territory. The workshop approach was really engaging and appreciated. So many ideas flowing. We left very motivated and excited about what's next!,"I thought it was a good allocation of time to the presentation, workshop and downtime. Perhaps it was just me getting super excited about all the ideas in the workshop ... having a bit more time to develop these to the next stage would have been great - but no doubt we will build on what we started over the coming week and months"
2026-03-03 18:22:20,Michelle Meneguzzi,ZENITH MEDIA Brisbane,michelle.meneguzzi@zenithmedia.com,Agency,fy26-nca-frontiers-evt-qld-consortium-zenith-client,0012y00000L5YjWAAV,003OY00000cbs5EYAQ,Frontiers 2026,886661,3,4,,4,3,5,,It was hard to remember how everything was defined,
2026-03-03 17:43:28,Kate Lippett,ZENITH MEDIA Brisbane,kate.lippett@publicisgroupe.net,Agency,fy26-nca-frontiers-evt-qld-consortium-zenith-client,0012y00000L5YjWAAV,0032y00000IC8SMAA1,Frontiers 2026,886646,5,5,,N/A,4,5,Have a quick 10-minute discovery call to discuss specific goals,Leigh did a great job crystallising an insight from the research.,
2026-03-03 17:33:06,Kym Poynter (Barron),ZENITH MEDIA Brisbane,kym.poynter@zenithmedia.com,Agency,fy26-nca-frontiers-evt-qld-consortium-zenith-client,0012y00000L5YjWAAV,003OY00000YkLc9YAF,Frontiers 2026,886642,5,5,,5,4,5,,Have an information session to kick off the day and then dedicated client specific workshops was the best format I've seen and much more valuable.,I think the workshops were great but a bit more pre- work would have helped.  Particularly checking in to ensure that the category we were using to do the passion work was the most suited category for the client   (Knowing that client objectives change very quickly and we'd rather be able to update you in advance if there is a different direction being taken )
2026-03-03 17:29:31,Laura Henry,Dentsu X Australia Pty Ltd..,laura.henry@dentsu.com,Agency,fy26-nca-frontiers-evt-qld-consortium-dentsu-client,0019000000npAwEAAU,0032y00000ICImAAAX,Frontiers 2026,886636,4,4,,5,4,4,,It felt like an exciting and intersting way in for clients,I value the real life application of the research - always love to examples of brands doing it well to really crystalise the theory
2026-03-05 17:27:49,India Williams,Super Retail Group,india.williams@supercheapauto.com,Client,fy26-nca-frontiers-evt-qld-consortium-omnicom-client,0019000000npX7hAAE,0032y00000Lr872AAB,Frontiers 2026,887523,5,4,,4,4,3,,The 1:1 sessions were so valuable. Looking forward to seeing the research data.,
2026-03-03 15:14:00,Warwick Taylor,ZENITH MEDIA Brisbane,warwick.taylor@zenithmedia.com,Agency,fy26-nca-frontiers-evt-qld-consortium-zenith-client,0012y00000L5YjWAAV,0039000000oz02iAAA,Frontiers 2026,886554,4,4,,4,4,4,,,
2026-03-03 16:32:37,Ryan Kovchenko,FCL Marketing Brisbane Head Office,ryan.kovchenko@flightcentre.com,Client,fy26-nca-frontiers-evt-qld-consortium-zenith-client,0019000000npLqYAAU,003OY00000bhzxRYAQ,Frontiers 2026,886617,5,5,,4,5,5,,Such a clear and concise way to make marketing efforts relevant.,Allow for a recording or share the deck. Would love to have it as a resource to come back to when sharing with the team.
2026-03-26 18:01:17,Jason Shugg,Australian Pacific Touring HEAD OFFICE,jason.shugg@aptouring.com.au,Client,fy26-nca-frontiers-evt-vic-indies-client,0019000000npBRrAAM,003Ii000001nLdlIAE,Frontiers 2026,893306,5,5,4,4,4,5,,"good content, right amount of time for the session",